{
    "title": "Marine Conservation Scientist",
    "description": "Lead research and conservation projects focused on marine ecosystems. Collaborate with academic institutions, government agencies, and non-profits to promote ocean sustainability.",
    "seniority": "Senior",
    "idealCompany": "Ocean Conservation Alliance",
    "idealSalary": "$80,000 - $100,000",
    "reasons": [
        "Passionate about marine conservation",
        "Desire to make a positive impact on the environment",
        "Looking for opportunities to lead research projects"
    ],
    "location": "Seattle, WA",
    "remote": false,
    "industry": "Environmental Science"
}
